Link Name,Center of Mass X,Center of Mass Y,Center of Mass Z,Center of Mass Roll,Center of Mass Pitch,Center of Mass Yaw,Mass,Moment Ixx,Moment Ixy,Moment Ixz,Moment Iyy,Moment Iyz,Moment Izz,Visual X,Visual Y,Visual Z,Visual Roll,Visual Pitch,Visual Yaw,Mesh Filename,Color Red,Color Green,Color Blue,Color Alpha,Collision X,Collision Y,Collision Z,Collision Roll,Collision Pitch,Collision Yaw,Collision Mesh Filename,Material Name,SW Components,Coordinate System,Axis Name,Joint Name,Joint Type,Joint Origin X,Joint Origin Y,Joint Origin Z,Joint Origin Roll,Joint Origin Pitch,Joint Origin Yaw,Parent,Joint Axis X,Joint Axis Y,Joint Axis Z,Limit Effort,Limit Velocity,Limit Lower,Limit Upper,Calibration rising,Calibration falling,Dynamics Damping,Dynamics Friction,Safety Soft Upper,Safety Soft Lower,Safety K Position,Safety K Velocity
base_link,6.5563E-05,0.00016333,0.032978,0,0,0,0.66063,0.00090211,-1.8473E-05,5.9669E-14,0.003573,2.6351E-14,0.0043507,0,0,0,0,0,0,package://drone_urdf2/meshes/base_link.STL,1,0,0,1,0,0,0,0,0,0,package://drone_urdf2/meshes/base_link.STL,,Drone V Assembly.stp-1/Upper frame.stp-1;Drone V Assembly.stp-1/Rod holder.stp-4;Drone V Assembly.stp-1/lower frame.stp-1;Drone V Assembly.stp-1/Rod holder.stp-3;Drone V Assembly.stp-1/Servo gear.stp-2/Mg995_Varsayilan.stp-1;Drone V Assembly.stp-1/Servo gear.stp-1/Mg995_Varsayilan.stp-1;Drone V Assembly.stp-1/Rod holder.stp-1;Drone V Assembly.stp-1/Rod holder.stp-2,Coordinate System1,,,,0,0,0,0,0,0,,0,0,0,,,,,,,,,,,,
Link_1,-5.4113063752137E-09,-2.5924262458954E-08,2.04494028932523E-08,0,0,0,0.0117525934249256,6.13467229946355E-05,5.33110194548022E-13,1.37675843009824E-11,6.64025500655714E-07,-1.20216600239056E-13,6.13482886382559E-05,0,0,0,0,0,0,package://drone_urdf2/meshes/Link_1.STL,0.792156862745098,0.819607843137255,0.933333333333333,1,0,0,0,0,0,0,package://drone_urdf2/meshes/Link_1.STL,,Drone V Assembly.stp-1/CF gear Assem.stp-2/CF rod.stp-1,Coordinate System12,Axis5,joint_1,revolute,-0.135,0.001393,0.03,0,0,0,base_link,0,1,0,0,0,0,0,,,,,,,,
Link_2,-0.000255100242262468,-0.0338251910857813,-0.0554553521915526,0,0,0,0.185605397053264,0.000283700924805311,-7.86562401584853E-08,2.82564538365549E-07,0.000523058821781675,1.67938496549037E-08,0.000308730661063502,0,0,0,0,0,0,package://drone_urdf2/meshes/Link_2.STL,0.792156862745098,0.819607843137255,0.933333333333333,1,0,0,0,0,0,0,package://drone_urdf2/meshes/Link_2.STL,,"Drone V Assembly.stp-1/edf case.stp-3/Wheel.stp-1;Drone V Assembly.stp-1/edf case.stp-3/EDF impeller 70mm 12blades 2___ _________.stp-1/pan cross head_am_B18.6.7M - M3 x 0.5 x 13 Type I Cross Recessed PHMS --13N.stp-1;Drone V Assembly.stp-1/edf case.stp-3/EDF impeller 70mm 12blades 2___ _________.stp-1/cowl___ _________.stp-1;Drone V Assembly.stp-1/edf case.stp-3/EDF impeller 70mm 12blades 2___ _________.stp-1/blades___ _________.stp-1;Drone V Assembly.stp-1/edf case.stp-3/EDF impeller 70mm 12blades 2___ _________.stp-1/conguser___ _________.stp-1;Drone V Assembly.stp-1/edf case.stp-3/EDF impeller 70mm 12blades 2___ _________.stp-1/body___ _________.stp-1;Drone V Assembly.stp-1/edf case.stp-3/edf case new 2.stp-1;Drone V Assembly.stp-1/edf case.stp-3/edf case new.stp-1;Drone V Assembly.stp-1/edf case.stp-3/EDF impeller 70mm 12blades 2___ _________.stp-1/hex nut style 1_am_B18.2.4.1M - Hex nut, Style 1,  M8 x 1.25 --D-N.stp-1;Drone V Assembly.stp-1/edf case.stp-3/EDF impeller 70mm 12blades 2___ _________.stp-1/engine___ _________.stp-1",Coordinate System9,Axis1,joint_2,revolute,0.00029704,-0.16534,0.058371,0,0,0,Link_1,0.011407,0,0.99993,0,0,0,0,,,,,,,,
Link_3,-0.000427471788521899,0.0339711317114997,-0.0537203104105317,0,0,0,0.185605390675731,0.000283701045802814,-7.90283112890916E-08,2.88500697653678E-07,0.000523058820701653,-1.49829304066838E-08,0.000308730504133049,0,0,0,0,0,0,package://drone_urdf2/meshes/Link_3.STL,0.792156862745098,0.819607843137255,0.933333333333333,1,0,0,0,0,0,0,package://drone_urdf2/meshes/Link_3.STL,,"Drone V Assembly.stp-1/edf case.stp-4/EDF impeller 70mm 12blades 2___ _________.stp-1/blades___ _________.stp-1;Drone V Assembly.stp-1/edf case.stp-4/EDF impeller 70mm 12blades 2___ _________.stp-1/pan cross head_am_B18.6.7M - M3 x 0.5 x 13 Type I Cross Recessed PHMS --13N.stp-1;Drone V Assembly.stp-1/edf case.stp-4/Wheel.stp-1;Drone V Assembly.stp-1/edf case.stp-4/edf case new.stp-1;Drone V Assembly.stp-1/edf case.stp-4/EDF impeller 70mm 12blades 2___ _________.stp-1/body___ _________.stp-1;Drone V Assembly.stp-1/edf case.stp-4/EDF impeller 70mm 12blades 2___ _________.stp-1/cowl___ _________.stp-1;Drone V Assembly.stp-1/edf case.stp-4/EDF impeller 70mm 12blades 2___ _________.stp-1/hex nut style 1_am_B18.2.4.1M - Hex nut, Style 1,  M8 x 1.25 --D-N.stp-1;Drone V Assembly.stp-1/edf case.stp-4/EDF impeller 70mm 12blades 2___ _________.stp-1/engine___ _________.stp-1;Drone V Assembly.stp-1/edf case.stp-4/edf case new 2.stp-1;Drone V Assembly.stp-1/edf case.stp-4/EDF impeller 70mm 12blades 2___ _________.stp-1/conguser___ _________.stp-1",Coordinate System10,Axis2,joint_3,revolute,0.00045208,0.1652,0.056636,0,0,0,Link_1,0.011407,0,0.99993,0,0,0,0,,,,,,,,
Link_4,-5.86360249243967E-09,2.59206679453783E-08,-2.03252708552704E-08,0,0,0,0.0117525934325749,6.13467231986159E-05,-5.34227872607456E-13,2.18011791322445E-11,6.64025500753099E-07,-1.08537710204228E-13,6.13482884767918E-05,0,0,0,0,0,0,package://drone_urdf2/meshes/Link_4.STL,0.792156862745098,0.819607843137255,0.933333333333333,1,0,0,0,0,0,0,package://drone_urdf2/meshes/Link_4.STL,,Drone V Assembly.stp-1/CF gear Assem.stp-1/CF rod.stp-1,Coordinate System13,Axis6,joint_4,revolute,0.135,0,0.03,0,0,0,base_link,0,-1,0,0,0,0,0,,,,,,,,
Link_5,-0.000249700404364062,-0.0338251995515797,-0.0554553886807976,0,0,0,0.185605351162656,0.000283700863267384,-7.86573352674983E-08,2.80130687170455E-07,0.000523058815232003,1.67834003494062E-08,0.000308730716976049,0,0,0,0,0,0,package://drone_urdf2/meshes/Link_5.STL,0.792156862745098,0.819607843137255,0.933333333333333,1,0,0,0,0,0,0,package://drone_urdf2/meshes/Link_5.STL,,"Drone V Assembly.stp-1/edf case.stp-1/EDF impeller 70mm 12blades 2___ _________.stp-1/conguser___ _________.stp-1;Drone V Assembly.stp-1/edf case.stp-1/Wheel.stp-1;Drone V Assembly.stp-1/edf case.stp-1/EDF impeller 70mm 12blades 2___ _________.stp-1/body___ _________.stp-1;Drone V Assembly.stp-1/edf case.stp-1/edf case new 2.stp-1;Drone V Assembly.stp-1/edf case.stp-1/edf case new.stp-1;Drone V Assembly.stp-1/edf case.stp-1/EDF impeller 70mm 12blades 2___ _________.stp-1/blades___ _________.stp-1;Drone V Assembly.stp-1/edf case.stp-1/EDF impeller 70mm 12blades 2___ _________.stp-1/cowl___ _________.stp-1;Drone V Assembly.stp-1/edf case.stp-1/EDF impeller 70mm 12blades 2___ _________.stp-1/engine___ _________.stp-1;Drone V Assembly.stp-1/edf case.stp-1/EDF impeller 70mm 12blades 2___ _________.stp-1/pan cross head_am_B18.6.7M - M3 x 0.5 x 13 Type I Cross Recessed PHMS --13N.stp-1;Drone V Assembly.stp-1/edf case.stp-1/EDF impeller 70mm 12blades 2___ _________.stp-1/hex nut style 1_am_B18.2.4.1M - Hex nut, Style 1,  M8 x 1.25 --D-N.stp-1",Coordinate System14,Axis3,joint_5,revolute,0.00029134,-0.16534,0.05837,0,0,0,Link_4,0.01131,0,0.99994,0,0,0,0,,,,,,,,
Link_6,0.000757409969281642,0.0337775856601109,-0.0554507224627409,0,0,0,0.185604947450906,0.000283698894876373,-7.87452502605569E-08,-1.78597930509087E-07,0.00052305870165037,-1.64587791090305E-08,0.000308732501183561,0,0,0,0,0,0,package://drone_urdf2/meshes/Link_6.STL,0.792156862745098,0.819607843137255,0.933333333333333,1,0,0,0,0,0,0,package://drone_urdf2/meshes/Link_6.STL,,"Drone V Assembly.stp-1/edf case.stp-2/Wheel.stp-1;Drone V Assembly.stp-1/edf case.stp-2/EDF impeller 70mm 12blades 2___ _________.stp-1/cowl___ _________.stp-1;Drone V Assembly.stp-1/edf case.stp-2/EDF impeller 70mm 12blades 2___ _________.stp-1/blades___ _________.stp-1;Drone V Assembly.stp-1/edf case.stp-2/edf case new.stp-1;Drone V Assembly.stp-1/edf case.stp-2/EDF impeller 70mm 12blades 2___ _________.stp-1/conguser___ _________.stp-1;Drone V Assembly.stp-1/edf case.stp-2/EDF impeller 70mm 12blades 2___ _________.stp-1/body___ _________.stp-1;Drone V Assembly.stp-1/edf case.stp-2/EDF impeller 70mm 12blades 2___ _________.stp-1/pan cross head_am_B18.6.7M - M3 x 0.5 x 13 Type I Cross Recessed PHMS --13N.stp-1;Drone V Assembly.stp-1/edf case.stp-2/EDF impeller 70mm 12blades 2___ _________.stp-1/hex nut style 1_am_B18.2.4.1M - Hex nut, Style 1,  M8 x 1.25 --D-N.stp-1;Drone V Assembly.stp-1/edf case.stp-2/EDF impeller 70mm 12blades 2___ _________.stp-1/engine___ _________.stp-1;Drone V Assembly.stp-1/edf case.stp-2/edf case new 2.stp-1",Coordinate System11,Axis4,joint_6,revolute,-0.00078724,0.1654,0.058369,0,0,0,Link_4,-0.0072518,0,0.99997,0,0,0,0,,,,,,,,
